ID,Author,Author_Greek,Work_Title,Work_Title_English,TLG_Number,Date_Approx,Book_Chapter_Line,Greek_Text_Excerpt,English_Translation,Substance_Described,Substance_Latin_Scientific,Ritual_Context,Death_Resurrection_Relevance,Notes
41,Josephus,Ἰώσηπος,Ἰουδαϊκὸς Πόλεμος,Jewish War,TLG 0526.003,~75 CE,7.8.7,"[prose] ἐκ μέθης... ἡ ψυχὴ ἐλευθερωθεῖσα... ἐπανέρχεται","As from drunkenness... the soul, having been freed... returns",Sleep as death-analogue; drunkenness as death-analogue (μέθη),Wine (metaphorical),Eleazar's philosophical speech at Masada; death-contemplation,"Soul leaves body in sleep as death rehearsal; drunkenness = pharmacological death-simulation; soul returns = resurrection","Jewish Hellenistic synthesis: Greek mystery-philosophical language about sleep/drug/death used by Jewish commander"
42,Mark,Μάρκος,Κατὰ Μάρκον,Gospel of Mark,TLG 0031.001,~70 CE,15:23,"καὶ ἐδίδουν αὐτῷ ἐσμυρνισμένον οἶνον· ὃς δὲ οὐκ ἔλαβεν","And they offered him myrrh-mixed wine; but he did not take it",Myrrh-wine (ἐσμυρνισμένον οἶνον),Commiphora myrrha (myrrh as analgesic/narcotic),Crucifixion; possibly merciful preparation before death,"Jesus REFUSES the death-analgesic/narcotic preparation; chooses to die fully conscious","Myrrh = standard anointing/burial substance; also pharmacologically active; refusing it = refusing pharmacological death-mitigation"
43,Matthew,Ματθαῖος,Κατὰ Ματθαῖον,Gospel of Matthew,TLG 0031.002,~80-90 CE,27:34,"ἔδωκαν αὐτῷ πιεῖν οἶνον μετὰ χολῆς μεμιγμένον· καὶ γευσάμενος οὐκ ἤθελεν πίειν","They gave him wine mixed with gall to drink; having tasted he would not drink",Gall-wine (οἶνος μετὰ χολῆς),Bitter herb compound; possibly Citrullus colocynthis (colocynth) or Artemisia absinthium,"Crucifixion preparation; death-inducing/analgesic offered","Tasting then refusing: Jesus recognized and rejected the pharmacological preparation","χολή in LXX = death/punishment (Jer 9:15); structural: two death-pharmaka offered and refused"
44,John,Ἰωάννης,Κατὰ Ἰωάννην,Gospel of John,TLG 0031.004,~90-100 CE,19:29-30,"σκεῦος ἔκειτο ὄξους μεστόν· σπόγγον οὖν μεστὸν τοῦ ὄξους ὑσσώπῳ περιθέντες προσήνεγκαν αὐτοῦ τῷ στόματι","A vessel full of sour wine stood there; placing a sponge full of sour wine on hyssop they brought it to his mouth",Sour wine (ὄξος) on hyssop-mounted sponge,Acetum (posca — Roman soldier's drink); possibly spiked with mandrake/opium,"Crucifixion; liturgically freighted (hyssop = purification in Passover and LXX)","Jesus ACCEPTS ὄξος → immediately dies; in sequence: refuse death-A → refuse death-B → accept C → die","If sponge contained mandrake/opium masked by vinegar: pharmacological death sequence; hyssop = LXX purification plant (Ps 51:7; Ex 12:22)"
45,John,Ἰωάννης,Κατὰ Ἰωάννην,Gospel of John,TLG 0031.004,~90-100 CE,19:39-40,"ἦλθεν δὲ καὶ Νικόδημος... φέρων μίγμα σμύρνης καὶ ἀλόης ὡς λίτρας ἑκατόν","Nicodemus came... bringing a mixture of myrrh and aloe, about a hundred litrai",Myrrh + aloe burial mixture (100 litrai = ~33 kg),Commiphora myrrha + Aloe vera / Aquilaria agallocha,Jewish burial preparation,"Massive quantity of pharmacologically active substances applied at burial; myrrh = analgesic; aloe = potentially Aquilaria (agarwood incense)","Quantity (100 litrai) far exceeds normal embalming needs; pharmacological density of burial narrative deserves study"
46,NT/LXX,various,Σοφία Σολομῶντος,Wisdom of Solomon,TLG 0527.001 (LXX),~1st c. BCE,7:17-22,"ἔδωκέν μοι... γνῶσιν τῶν ὄντων... δυνάμεις ῥιζῶν... καὶ φαρμάκων ἐπίσκεψιν","He [God] gave me knowledge of existing things... powers of roots... and examination of pharmaka",Pharmaka from roots (ῥίζαι),Generic (Wisdom tradition),Solomonic wisdom tradition; pharmacological knowledge as divine gift,"Pharmacological knowledge (ῥίζαι) given by God = sacred; places pharmaka within Jewish-Hellenistic theological framework","LXX Wisdom combines Greek pharmacological tradition with Jewish theological framing; available to Jesus as scripture"
47,Theophrastus,Θεόφραστος,Περὶ φυτῶν ἱστορία,Historia Plantarum,TLG 0085.001,~300 BCE,9.15.1-7,"ἐλλέβορος λευκός... δραστικώτερον φάρμακον καὶ χαλεπώτερον","White hellebore... a more active drug and more dangerous",White hellebore (ἐλλέβορος λευκός),Veratrum album / Helleborus niger,Cure for madness (Melampus myth); purgative initiation,"Purging = death-like crisis → restored sanity = rebirth pattern; Melampus myth = pharmacological initiation charter","Melampus tradition: hellebore cures divine madness (of Proetus's daughters) = pharmacological healing of divine punishment"
48,Strabo,Στράβων,Γεωγραφικά,Geography,TLG 0099.001,~20 BCE - 20 CE,11.2.17-18,"[prose] ἡ Μήδεια... φαρμακεία... τὰ τοῦ Πόντου φάρμακα","Medea... her drug-craft... the pharmaka of Pontus",Pontic pharmaka (general; Medea-associated),Black Sea botanical tradition (aconite, mandrake, etc.),Colchian/Medea mythological tradition; geographical pharmacological source,"Strabo confirms Pontus as geographical origin of Greek pharmakological tradition; Medea = Pontic = Mithridatic lineage","Pontus → Medea myth → Mithridates VI (also Pontic king): geographical continuity of pharmacological tradition"
49,Pliny the Elder,Plinius Maior,Naturalis Historia,Natural History,N/A (Latin),~77 CE,25.147-150,"[Latin] mandragorae radix... per annum in vino macerata... ante sectiones et puncturas","The root of mandrake... soaked in wine for a year... given before cuttings and piercings",Mandrake wine (vinum mandragorae),Mandragora officinarum,Surgical anesthesia; Roman medical practice,"Same procedure as Dioscorides and Theophrastus: anesthetic death-sleep for surgery; awakening = resurrection","By 1st c. CE mandrake wine is standard surgical anesthetic across Greek-Roman medicine"
50,Euripides,Εὐριπίδης,Μήδεια,Medea,TLG 0006.003,431 BCE,716-718,"τεκεῖν σέ φημι παῖδας, ὧν ἔχω φάρμακα","I will make you father children; I have the pharmaka for it",Fertility pharmaka,Unknown herbal compounds,Bargain with Aegeus; pharmaka as exchange currency,"Life-giving pole of pharmacological spectrum: fertility drugs opposite to death-drugs; Medea controls both poles","Medea's power = full life/death pharmaceutical spectrum; she can give life (fertility) or take it (poison)"
